{
  "$schema": "../../schemas/garden-crop.schema.json",
  "key": "florence_fennel",
  "name": {
    "value": {
      "en": "Florence fennel",
      "cs": "Fenykl hlíznatý",
      "sk": "Fenikel hľuzový",
      "de": "Knollenfenchel",
      "pl": "Fenkuł włoski"
    },
    "source": "eppo-gd",
    "drafted": true
  },
  "name_latin": { "value": "Foeniculum vulgare var. azoricum", "source": "powo", "drafted": true },
  "family": { "value": "apiaceae", "source": "powo", "drafted": true },
  "plant_type": { "value": "vegetable", "source": "rhs-grow-your-own", "drafted": true },
  "life_cycle": { "value": "annual", "source": "rhs-grow-your-own", "drafted": true },
  "propagation": { "value": "seed", "source": "rhs-grow-your-own", "drafted": true },
  "hardiness": { "value": "half_hardy", "source": "rhs-hardiness", "drafted": true },
  "feeder_class": { "value": "medium", "source": "rhs-crop-rotation", "drafted": true },
  "root_depth": { "value": "medium", "source": "rhs-grow-your-own", "drafted": true },
  "sun": { "value": "full", "source": "rhs-grow-your-own", "drafted": true },
  "water_need": { "value": "high", "source": "rhs-grow-your-own", "drafted": true },
  "soil_ph": { "value": { "min": 6, "max": 7.5 }, "source": "rutgers-soil-ph", "drafted": true },
  "rotation_break_years": { "value": 3, "source": "lwg-2111-fruchtfolge", "drafted": true },
  "sow_depth_cm": { "value": 1.5, "source": "rhs-grow-your-own", "drafted": true },
  "spacing": {
    "value": { "row_cm": 40, "plant_cm": 25 },
    "source": "vt-planting-guide",
    "drafted": true
  },
  "plants_per_m2": { "value": 10, "source": "vt-planting-guide", "drafted": true },
  "germination_temp_c": { "value": 10, "source": "harrington-germination", "drafted": true },
  "days_to_germinate": {
    "value": { "min": 7, "max": 14 },
    "source": "harrington-germination",
    "drafted": true
  },
  "days_to_maturity": {
    "value": { "min": 80, "max": 100 },
    "source": "rhs-grow-your-own",
    "drafted": true
  },
  "windows": {
    "sow_direct": {
      "value": { "anchor": "first_frost", "from_days": -110, "to_days": -80 },
      "source": "rhs-grow-your-own",
      "drafted": true
    },
    "harvest": {
      "value": { "anchor": "first_frost", "from_days": -25, "to_days": 20 },
      "source": "rhs-grow-your-own",
      "drafted": true
    }
  },
  "care_tasks": { "value": ["mulch"], "source": "rhs-grow-your-own", "drafted": true },
  "harvest_unit": { "value": "piece", "source": "rhs-grow-your-own", "drafted": true },
  "yield": {
    "value": { "per_m2": 9, "per_plant": 1 },
    "source": "vt-planting-guide",
    "drafted": true
  },
  "storage": {
    "value": [
      { "method": "fresh", "shelf_life_days": 10 },
      { "method": "cool_store", "shelf_life_days": 30 },
      { "method": "frozen", "shelf_life_days": 300 }
    ],
    "source": "usda-handbook-66",
    "drafted": true
  },
  "pests": { "value": ["slug", "aphid"], "source": "eppo-gd", "drafted": true },
  "diseases": { "value": ["bolting"], "source": "eppo-gd", "drafted": true },
  "care_notes": {
    "value": {
      "en": "Sow where it is to grow, after the longest day: earlier sowings, root disturbance and drought all make it bolt instead of forming a bulb. Earth up the swelling bulbs to keep them white and tender.",
      "cs": "Vysévejte přímo na místo až po nejdelším dni: dřívější výsev, poškození kořenů i sucho vedou k vybíhání do květu místo tvorby hlízy. Tloustnoucí hlízy přihrňte, aby zůstaly bílé a křehké.",
      "sk": "Vysievajte priamo na miesto až po najdlhšom dni: skorší výsev, poškodenie koreňov aj sucho vedú k vybiehaniu do kvetu namiesto tvorby hľuzy. Hrubnúce hľuzy prihrňte, aby zostali biele a krehké.",
      "de": "Erst nach dem längsten Tag an Ort und Stelle säen: Frühere Aussaat, Wurzelstörung und Trockenheit lassen ihn schossen, statt eine Knolle zu bilden. Die schwellenden Knollen anhäufeln, damit sie weiß und zart bleiben.",
      "pl": "Siej wprost na miejsce dopiero po najdłuższym dniu: wcześniejszy siew, uszkodzenie korzeni i susza sprawiają, że wybija w pędy zamiast tworzyć zgrubienie. Grubiejące zgrubienia obsyp, aby pozostały białe i delikatne."
    },
    "source": "rhs-grow-your-own",
    "drafted": true
  }
}
