{
  "$schema": "../../schemas/garden-crop.schema.json",
  "key": "red_cabbage",
  "name": {
    "value": {
      "en": "Red cabbage",
      "cs": "Zelí červené",
      "sk": "Kapusta červená",
      "de": "Rotkohl",
      "pl": "Kapusta czerwona"
    },
    "source": "eppo-gd",
    "drafted": true
  },
  "name_latin": {
    "value": "Brassica oleracea var. capitata f. rubra",
    "source": "powo",
    "drafted": true
  },
  "family": { "value": "brassicaceae", "source": "powo", "drafted": true },
  "plant_type": { "value": "vegetable", "source": "rhs-grow-your-own", "drafted": true },
  "life_cycle": { "value": "annual", "source": "rhs-grow-your-own", "drafted": true },
  "propagation": { "value": "seed", "source": "rhs-grow-your-own", "drafted": true },
  "hardiness": { "value": "half_hardy", "source": "rhs-hardiness", "drafted": true },
  "feeder_class": { "value": "heavy", "source": "rhs-crop-rotation", "drafted": true },
  "root_depth": { "value": "medium", "source": "rhs-grow-your-own", "drafted": true },
  "sun": { "value": "full", "source": "rhs-grow-your-own", "drafted": true },
  "water_need": { "value": "high", "source": "rhs-grow-your-own", "drafted": true },
  "soil_ph": { "value": { "min": 6.5, "max": 7.5 }, "source": "rutgers-soil-ph", "drafted": true },
  "rotation_break_years": { "value": 4, "source": "lwg-2111-fruchtfolge", "drafted": true },
  "sow_depth_cm": { "value": 1, "source": "rhs-grow-your-own", "drafted": true },
  "spacing": {
    "value": { "row_cm": 60, "plant_cm": 50 },
    "source": "vt-planting-guide",
    "drafted": true
  },
  "plants_per_m2": { "value": 3.3, "source": "vt-planting-guide", "drafted": true },
  "germination_temp_c": { "value": 5, "source": "harrington-germination", "drafted": true },
  "days_to_germinate": {
    "value": { "min": 5, "max": 10 },
    "source": "harrington-germination",
    "drafted": true
  },
  "days_to_maturity": {
    "value": { "min": 100, "max": 140 },
    "source": "rhs-grow-your-own",
    "drafted": true
  },
  "windows": {
    "sow_indoor": {
      "value": { "anchor": "last_frost", "from_days": -45, "to_days": -20 },
      "source": "rhs-grow-your-own",
      "drafted": true
    },
    "transplant": {
      "value": { "anchor": "last_frost", "from_days": 0, "to_days": 25 },
      "source": "rhs-grow-your-own",
      "drafted": true
    },
    "harvest": {
      "value": { "anchor": "first_frost", "from_days": -30, "to_days": 30 },
      "source": "rhs-grow-your-own",
      "drafted": true
    }
  },
  "care_tasks": {
    "value": ["harden_off", "pest_check"],
    "source": "rhs-grow-your-own",
    "drafted": true
  },
  "harvest_unit": { "value": "kg", "source": "rhs-grow-your-own", "drafted": true },
  "yield": {
    "value": { "per_m2": 4.5, "per_plant": 1.5 },
    "source": "vt-planting-guide",
    "drafted": true
  },
  "storage": {
    "value": [
      { "method": "cool_store", "shelf_life_days": 150 },
      { "method": "fresh", "shelf_life_days": 21 },
      { "method": "canned", "shelf_life_days": 365 },
      { "method": "frozen", "shelf_life_days": 300 }
    ],
    "source": "usda-handbook-66",
    "drafted": true
  },
  "pests": {
    "value": ["cabbage_white", "cabbage_moth", "cabbage_root_fly", "cabbage_aphid", "flea_beetle"],
    "source": "eppo-gd",
    "drafted": true
  },
  "diseases": {
    "value": ["clubroot", "black_rot", "downy_mildew"],
    "source": "eppo-gd",
    "drafted": true
  },
  "care_notes": {
    "value": {
      "en": "Slower than white cabbage and in need of the whole season, with steady water and feeding. Cut heads for storing in dry weather before hard frost, with a few outer leaves left on, and they keep in a cool cellar until spring.",
      "cs": "Roste pomaleji než bílé zelí a potřebuje celou sezonu, stálou vláhu a výživu. Hlávky na uskladnění sklízejte za sucha před silnými mrazy i s několika obalovými listy; v chladném sklepě vydrží do jara.",
      "sk": "Rastie pomalšie než biela kapusta a potrebuje celú sezónu, stálu vlahu a výživu. Hlávky na uskladnenie zberajte za sucha pred silnými mrazmi aj s niekoľkými obalovými listami; v chladnej pivnici vydržia do jari.",
      "de": "Wächst langsamer als Weißkohl und braucht die ganze Saison, gleichmäßige Feuchte und Nährstoffe. Lagerköpfe bei trockenem Wetter vor starkem Frost mit einigen Umblättern schneiden; im kühlen Keller halten sie bis zum Frühjahr.",
      "pl": "Rośnie wolniej niż kapusta biała i potrzebuje całego sezonu, stałej wilgoci i nawożenia. Główki do przechowania ścinaj w suchą pogodę przed silnymi mrozami, z kilkoma liśćmi okrywowymi; w chłodnej piwnicy wytrzymują do wiosny."
    },
    "source": "rhs-grow-your-own",
    "drafted": true
  }
}
