{
  "$schema": "../../schemas/garden-crop.schema.json",
  "key": "courgette",
  "name": {
    "value": {
      "en": "Courgette",
      "cs": "Cuketa",
      "sk": "Cuketa",
      "de": "Zucchini",
      "pl": "Cukinia"
    },
    "source": "eppo-gd",
    "drafted": true
  },
  "name_latin": { "value": "Cucurbita pepo var. cylindrica", "source": "powo", "drafted": true },
  "family": { "value": "cucurbitaceae", "source": "powo", "drafted": true },
  "plant_type": { "value": "vegetable", "source": "rhs-grow-your-own", "drafted": true },
  "life_cycle": { "value": "annual", "source": "rhs-grow-your-own", "drafted": true },
  "propagation": { "value": "seed", "source": "rhs-grow-your-own", "drafted": true },
  "hardiness": { "value": "tender", "source": "rhs-hardiness", "drafted": true },
  "feeder_class": { "value": "heavy", "source": "rhs-crop-rotation", "drafted": true },
  "root_depth": { "value": "medium", "source": "rhs-grow-your-own", "drafted": true },
  "sun": { "value": "full", "source": "rhs-grow-your-own", "drafted": true },
  "water_need": { "value": "high", "source": "rhs-grow-your-own", "drafted": true },
  "soil_ph": { "value": { "min": 6, "max": 7 }, "source": "rutgers-soil-ph", "drafted": true },
  "rotation_break_years": { "value": 3, "source": "lwg-2111-fruchtfolge", "drafted": true },
  "sow_depth_cm": { "value": 2.5, "source": "rhs-grow-your-own", "drafted": true },
  "spacing": {
    "value": { "row_cm": 100, "plant_cm": 80 },
    "source": "vt-planting-guide",
    "drafted": true
  },
  "plants_per_m2": { "value": 1.2, "source": "vt-planting-guide", "drafted": true },
  "germination_temp_c": { "value": 14, "source": "harrington-germination", "drafted": true },
  "days_to_germinate": {
    "value": { "min": 5, "max": 10 },
    "source": "harrington-germination",
    "drafted": true
  },
  "days_to_maturity": {
    "value": { "min": 45, "max": 60 },
    "source": "rhs-grow-your-own",
    "drafted": true
  },
  "windows": {
    "sow_indoor": {
      "value": { "anchor": "last_frost", "from_days": -28, "to_days": -14 },
      "source": "rhs-grow-your-own",
      "drafted": true
    },
    "sow_direct": {
      "value": { "anchor": "last_frost", "from_days": 0, "to_days": 21 },
      "source": "rhs-grow-your-own",
      "drafted": true
    },
    "transplant": {
      "value": { "anchor": "last_frost", "from_days": 7, "to_days": 21 },
      "source": "rhs-grow-your-own",
      "drafted": true
    },
    "harvest": {
      "value": { "anchor": "last_frost", "from_days": 50, "to_days": 140 },
      "source": "rhs-grow-your-own",
      "drafted": true
    }
  },
  "care_tasks": {
    "value": ["harden_off", "mulch"],
    "source": "rhs-grow-your-own",
    "drafted": true
  },
  "harvest_unit": { "value": "kg", "source": "rhs-grow-your-own", "drafted": true },
  "yield": {
    "value": { "per_m2": 5, "per_plant": 4 },
    "source": "vt-planting-guide",
    "drafted": true
  },
  "storage": {
    "value": [
      { "method": "fresh", "shelf_life_days": 10 },
      { "method": "frozen", "shelf_life_days": 300 },
      { "method": "canned", "shelf_life_days": 365 }
    ],
    "source": "usda-handbook-66",
    "drafted": true
  },
  "pests": { "value": ["slug", "aphid"], "source": "eppo-gd", "drafted": true },
  "diseases": {
    "value": ["powdery_mildew", "mosaic_virus", "grey_mould"],
    "source": "eppo-gd",
    "drafted": true
  },
  "care_notes": {
    "value": {
      "en": "Two plants are enough for a family. Cut the fruits at 15 to 20 cm, every two or three days. In cool, wet spells the first fruits rot from the tip because they were not pollinated; this passes as the weather warms.",
      "cs": "Pro rodinu stačí dvě rostliny. Plody sklízejte při délce 15 až 20 cm, každé dva až tři dny. Za chladného a deštivého počasí první plody od špičky zahnívají, protože nebyly opyleny; s oteplením to přejde.",
      "sk": "Pre rodinu stačia dve rastliny. Plody zberajte pri dĺžke 15 až 20 cm, každé dva až tri dni. Za chladného a daždivého počasia prvé plody od špičky zahnívajú, pretože neboli opelené; s oteplením to prejde.",
      "de": "Zwei Pflanzen reichen für eine Familie. Die Früchte mit 15 bis 20 cm Länge alle zwei bis drei Tage schneiden. Bei kühlem, nassem Wetter faulen die ersten Früchte von der Spitze her, weil sie nicht bestäubt wurden; mit der Wärme gibt sich das.",
      "pl": "Dla rodziny wystarczą dwie rośliny. Owoce zbieraj przy długości 15–20 cm, co dwa–trzy dni. W chłodne i mokre dni pierwsze owoce gniją od wierzchołka, bo nie zostały zapylone; mija to wraz z ociepleniem."
    },
    "source": "rhs-grow-your-own",
    "drafted": true
  }
}
