{
  "key": "tomato",
  "name": {
    "value": {
      "en": "Tomato (en)",
      "cs": "Tomato (cs)",
      "sk": "Tomato (sk)",
      "de": "Tomato (de)",
      "pl": "Tomato (pl)"
    },
    "source": "book"
  },
  "name_latin": {
    "value": "Solanum lycopersicum",
    "source": "book"
  },
  "family": {
    "value": "solanaceae",
    "source": "book"
  },
  "plant_type": {
    "value": "vegetable",
    "source": "book"
  },
  "life_cycle": {
    "value": "annual",
    "source": "book"
  },
  "propagation": {
    "value": "seed",
    "source": "book"
  },
  "hardiness": {
    "value": "tender",
    "source": "book"
  },
  "feeder_class": {
    "value": "heavy",
    "source": "book"
  },
  "root_depth": {
    "value": "deep",
    "source": "book"
  },
  "sun": {
    "value": "full",
    "source": "book"
  },
  "water_need": {
    "value": "high",
    "source": "book"
  },
  "soil_ph": {
    "value": {
      "min": 6,
      "max": 6.8
    },
    "source": "book"
  },
  "rotation_break_years": {
    "value": 3,
    "source": "book"
  },
  "sow_depth_cm": {
    "value": 0.5,
    "source": "book"
  },
  "spacing": {
    "value": {
      "row_cm": 80,
      "plant_cm": 50
    },
    "source": "book"
  },
  "germination_temp_c": {
    "value": 10,
    "source": "book"
  },
  "days_to_germinate": {
    "value": {
      "min": 6,
      "max": 14
    },
    "source": "book"
  },
  "days_to_maturity": {
    "value": {
      "min": 60,
      "max": 85
    },
    "source": "book"
  },
  "windows": {
    "sow_indoor": {
      "value": {
        "anchor": "last_frost",
        "from_days": -56,
        "to_days": -42
      },
      "source": "book"
    },
    "transplant": {
      "value": {
        "anchor": "last_frost",
        "from_days": 0,
        "to_days": 14
      },
      "source": "book"
    },
    "harvest": {
      "value": {
        "anchor": "last_frost",
        "from_days": 65,
        "to_days": 150
      },
      "source": "book"
    }
  },
  "care_tasks": {
    "value": [
      "support"
    ],
    "source": "book"
  },
  "harvest_unit": {
    "value": "kg",
    "source": "book"
  },
  "yield": {
    "value": {
      "per_m2": 5
    },
    "source": "book"
  },
  "storage": {
    "value": [
      {
        "method": "fresh",
        "shelf_life_days": 7
      }
    ],
    "source": "book"
  },
  "pests": {
    "value": [
      "aphid"
    ],
    "source": "book"
  },
  "diseases": {
    "value": [
      "blight"
    ],
    "source": "book"
  },
  "care_notes": {
    "value": {
      "en": "Water at the base. (en)",
      "cs": "Water at the base. (cs)",
      "sk": "Water at the base. (sk)",
      "de": "Water at the base. (de)",
      "pl": "Water at the base. (pl)"
    },
    "source": "book"
  },
  "varieties": [
    {
      "key": "early",
      "name": {
        "value": "Early One",
        "source": "book"
      },
      "overrides": {
        "days_to_maturity": {
          "value": {
            "min": 55,
            "max": 60
          },
          "source": "book"
        }
      }
    }
  ]
}
