{
  "$schema": "../../schemas/garden-crop.schema.json",
  "key": "kohlrabi",
  "name": {
    "value": {
      "en": "Kohlrabi",
      "cs": "Kedluben",
      "sk": "Kaleráb",
      "de": "Kohlrabi",
      "pl": "Kalarepa"
    },
    "source": "eppo-gd",
    "drafted": true
  },
  "name_latin": { "value": "Brassica oleracea var. gongylodes", "source": "powo", "drafted": true },
  "family": { "value": "brassicaceae", "source": "powo", "drafted": true },
  "plant_type": { "value": "vegetable", "source": "rhs-grow-your-own", "drafted": true },
  "life_cycle": { "value": "annual", "source": "rhs-grow-your-own", "drafted": true },
  "propagation": { "value": "seed", "source": "rhs-grow-your-own", "drafted": true },
  "hardiness": { "value": "half_hardy", "source": "rhs-hardiness", "drafted": true },
  "feeder_class": { "value": "medium", "source": "rhs-crop-rotation", "drafted": true },
  "root_depth": { "value": "shallow", "source": "rhs-grow-your-own", "drafted": true },
  "sun": { "value": "full", "source": "rhs-grow-your-own", "drafted": true },
  "water_need": { "value": "high", "source": "rhs-grow-your-own", "drafted": true },
  "soil_ph": { "value": { "min": 6, "max": 7.5 }, "source": "rutgers-soil-ph", "drafted": true },
  "rotation_break_years": { "value": 4, "source": "lwg-2111-fruchtfolge", "drafted": true },
  "sow_depth_cm": { "value": 1, "source": "rhs-grow-your-own", "drafted": true },
  "spacing": {
    "value": { "row_cm": 30, "plant_cm": 25 },
    "source": "vt-planting-guide",
    "drafted": true
  },
  "plants_per_m2": { "value": 13, "source": "vt-planting-guide", "drafted": true },
  "germination_temp_c": { "value": 5, "source": "harrington-germination", "drafted": true },
  "days_to_germinate": {
    "value": { "min": 5, "max": 10 },
    "source": "harrington-germination",
    "drafted": true
  },
  "days_to_maturity": {
    "value": { "min": 45, "max": 70 },
    "source": "rhs-grow-your-own",
    "drafted": true
  },
  "windows": {
    "sow_indoor": {
      "value": { "anchor": "last_frost", "from_days": -85, "to_days": -45 },
      "source": "rhs-grow-your-own",
      "drafted": true
    },
    "transplant": {
      "value": { "anchor": "last_frost", "from_days": -42, "to_days": 0 },
      "source": "rhs-grow-your-own",
      "drafted": true
    },
    "harvest": {
      "value": { "anchor": "last_frost", "from_days": 5, "to_days": 65 },
      "source": "rhs-grow-your-own",
      "drafted": true
    }
  },
  "care_tasks": {
    "value": ["prick_out", "harden_off", "pest_check"],
    "source": "rhs-grow-your-own",
    "drafted": true
  },
  "harvest_unit": { "value": "piece", "source": "rhs-grow-your-own", "drafted": true },
  "yield": {
    "value": { "per_m2": 12, "per_plant": 1 },
    "source": "vt-planting-guide",
    "drafted": true
  },
  "storage": {
    "value": [
      { "method": "fresh", "shelf_life_days": 14 },
      { "method": "frozen", "shelf_life_days": 300 }
    ],
    "source": "usda-handbook-66",
    "drafted": true
  },
  "pests": {
    "value": ["flea_beetle", "cabbage_root_fly", "cabbage_white", "cabbage_aphid", "slug"],
    "source": "eppo-gd",
    "drafted": true
  },
  "diseases": {
    "value": ["clubroot", "downy_mildew", "bolting"],
    "source": "eppo-gd",
    "drafted": true
  },
  "care_notes": {
    "value": {
      "en": "Plant shallow, with the swelling stem clear of the soil, and water evenly: drought turns the bulbs woody, and a soaking after it splits them. Harvest at tennis-ball size; sowings until midsummer give an autumn crop.",
      "cs": "Sázejte mělce, aby bulva zůstala nad zemí, a zalévejte rovnoměrně: v suchu bulvy dřevnatějí a po následné vydatné zálivce praskají. Sklízejte ve velikosti tenisového míčku; výsevy až do slunovratu dají podzimní sklizeň.",
      "sk": "Sádzajte plytko, aby buľva zostala nad zemou, a polievajte rovnomerne: v suchu buľvy drevnatejú a po následnej výdatnej zálievke praskajú. Zberajte vo veľkosti tenisovej loptičky; výsevy až do slnovratu dajú jesennú úrodu.",
      "de": "Flach pflanzen, sodass die Knolle über der Erde bleibt, und gleichmäßig gießen: Bei Trockenheit werden die Knollen holzig, nach starkem Wässern platzen sie. In Tennisballgröße ernten; Aussaaten bis zur Sommersonnenwende bringen eine Herbsternte.",
      "pl": "Sadź płytko, by zgrubienie pozostało nad ziemią, i podlewaj równomiernie: w suszy zgrubienia drewnieją, a po obfitym podlaniu pękają. Zbieraj, gdy osiągną wielkość piłki tenisowej; siewy aż do przesilenia letniego dają plon jesienny."
    },
    "source": "rhs-grow-your-own",
    "drafted": true
  }
}
