{
  "$schema": "../../schemas/garden-crop.schema.json",
  "key": "spring_onion",
  "name": {
    "value": {
      "en": "Spring onion",
      "cs": "Cibule sečka",
      "sk": "Cibuľa zimná",
      "de": "Lauchzwiebel",
      "pl": "Cebula siedmiolatka"
    },
    "source": "eppo-gd",
    "drafted": true
  },
  "name_latin": { "value": "Allium fistulosum", "source": "powo", "drafted": true },
  "family": { "value": "amaryllidaceae", "source": "powo", "drafted": true },
  "plant_type": { "value": "vegetable", "source": "rhs-grow-your-own", "drafted": true },
  "life_cycle": { "value": "annual", "source": "rhs-grow-your-own", "drafted": true },
  "propagation": { "value": "seed", "source": "rhs-grow-your-own", "drafted": true },
  "hardiness": { "value": "hardy", "source": "rhs-hardiness", "drafted": true },
  "feeder_class": { "value": "medium", "source": "rhs-crop-rotation", "drafted": true },
  "root_depth": { "value": "shallow", "source": "rhs-grow-your-own", "drafted": true },
  "sun": { "value": "full", "source": "rhs-grow-your-own", "drafted": true },
  "water_need": { "value": "medium", "source": "rhs-grow-your-own", "drafted": true },
  "soil_ph": { "value": { "min": 6, "max": 7 }, "source": "rutgers-soil-ph", "drafted": true },
  "rotation_break_years": { "value": 3, "source": "lwg-2111-fruchtfolge", "drafted": true },
  "sow_depth_cm": { "value": 1, "source": "rhs-grow-your-own", "drafted": true },
  "spacing": {
    "value": { "row_cm": 20, "plant_cm": 3 },
    "source": "vt-planting-guide",
    "drafted": true
  },
  "plants_per_m2": { "value": 165, "source": "vt-planting-guide", "drafted": true },
  "germination_temp_c": { "value": 5, "source": "harrington-germination", "drafted": true },
  "days_to_germinate": {
    "value": { "min": 10, "max": 21 },
    "source": "harrington-germination",
    "drafted": true
  },
  "days_to_maturity": {
    "value": { "min": 65, "max": 90 },
    "source": "rhs-grow-your-own",
    "drafted": true
  },
  "windows": {
    "sow_direct": {
      "value": { "anchor": "last_frost", "from_days": -50, "to_days": 45 },
      "source": "rhs-grow-your-own",
      "drafted": true
    },
    "harvest": {
      "value": { "anchor": "last_frost", "from_days": 20, "to_days": 140 },
      "source": "rhs-grow-your-own",
      "drafted": true
    }
  },
  "care_tasks": { "value": [], "source": "rhs-grow-your-own", "drafted": true },
  "harvest_unit": { "value": "bunch", "source": "rhs-grow-your-own", "drafted": true },
  "yield": { "value": { "per_m2": 14 }, "source": "vt-planting-guide", "drafted": true },
  "storage": {
    "value": [
      { "method": "fresh", "shelf_life_days": 7 },
      { "method": "in_ground", "shelf_life_days": 60 },
      { "method": "frozen", "shelf_life_days": 180 }
    ],
    "source": "usda-handbook-66",
    "drafted": true
  },
  "pests": {
    "value": ["allium_leaf_miner", "onion_fly", "leek_moth", "thrips"],
    "source": "eppo-gd",
    "drafted": true
  },
  "diseases": {
    "value": ["downy_mildew", "rust", "white_rot"],
    "source": "eppo-gd",
    "drafted": true
  },
  "care_notes": {
    "value": {
      "en": "Sow a short row every three weeks for a steady supply; a sowing in late summer stands the winter and is pulled in spring. It forms no bulb: pull it at pencil thickness, or leave a few plants to grow into a perennial clump.",
      "cs": "Pro stálou sklizeň vysévejte krátký řádek každé tři týdny; výsev z pozdního léta přezimuje a sklízí se na jaře. Cibuli netvoří: sklízejte ji silnou jako tužka, nebo pár rostlin nechte rozrůst ve vytrvalý trs.",
      "sk": "Pre stály zber vysievajte krátky riadok každé tri týždne; výsev z neskorého leta prezimuje a zberá sa na jar. Cibuľu netvorí: zberajte ju hrubú ako ceruzka, alebo pár rastlín nechajte rozrásť do trváceho trsu.",
      "de": "Für laufende Ernte alle drei Wochen eine kurze Reihe säen; eine Aussaat im Spätsommer überwintert und wird im Frühjahr geerntet. Sie bildet keine Zwiebel: bleistiftstark ziehen oder einige Pflanzen zu einem ausdauernden Horst heranwachsen lassen.",
      "pl": "Dla ciągłego zbioru siej krótki rządek co trzy tygodnie; siew z późnego lata zimuje i zbiera się go wiosną. Nie tworzy cebuli: wyrywaj ją przy grubości ołówka albo zostaw kilka roślin, by rozrosły się w wieloletnią kępę."
    },
    "source": "rhs-grow-your-own",
    "drafted": true
  }
}
